1937,Hubbard,OR,Cylinder,10 seconds,It had a bluish tint with what looked like a candle light in the center traveling slowly south.,45.1823,-122.8079
1949,Salem,OR,Cigar,2300,"Cigar Craft, Body Marks and Missing Time",44.9429,-123.0351
1950,Stanfield,OR,Disk,2 - 3 minutes,"In 1950, Eastern Oregon, I saw one silver, oval shaped disk hover for approximately 2 - 3 minutes before quickly accelerating away.",45.7804,-119.2172
1954,Corvallis (Near; small town of Alsea),OR,Diamond,1-2 mins.,"Disc top, or bottom to our view following, west to east, a 4 engine (prop) maybe a Tri Star (three rudders) About 1/2 way across our vi",44.5646,-123.2620
1958,Terrebonne,OR,Unknown,1-2 minutes,"Piercing, shrill tone.",44.3529,-121.1778
1960,Portland,OR,Disk,,Live TV broadcast from Portland OR in the summer of 1959 or 1960.,45.5231,-122.6765
1960,Portland,OR,Unknown,15-30 min,Stationary Lights Over Portland OR Around 1960,45.5231,-122.6765
1961,Newberg,OR,Egg,2.5 hours,"Bright orbs flying in sky west of Portland, Oregon",45.3001,-122.9732
1962,Beaverton,OR,Triangle,2 minutes,Daytime approach and stopped within short distance and was extremely visible.,45.4871,-122.8037
1963,Portland,OR,Sphere,1/2 hour,"1963 - Round hovering, soundless, rotating object over northeast Portland, Oregon",45.5231,-122.6765
1964,Drew,OR,Circle,20 minutes,Date/Time 07/1964 City: Drew State: Oregon Shape Silver(Metallic) Disc Duration 30 min Summary object hovered above work location .,42.8819,-122.8983
1964,Terrebonne,OR,Cigar,10 minutes,"Shimmering silver metallic shape.....no sound(s), moving slowly to the South.",44.3529,-121.1778
1965,Portland,OR,Disk,2 minutes,The object was stationary.,45.5231,-122.6765
1965,Portland,OR,Disk,20 minutes,"A football sized glowing orange saucer shaped object , hovering completely still over head, disappears into the horizon in a flash.",45.5231,-122.6765
1965,Beaverton,OR,Cigar,@ 5 seconds,"This was when i was @6y/o, I lived at the end of a mile long dead end road in rual washington co.Oregon.Surronded by wheat fields and w",45.4871,-122.8037
1965,Terrebonne,OR,Light,5-6 hours,"Pairs of RED LIGHTS spinning up, down, spiraling, twirling....as if playing.",44.3529,-121.1778
1966,Roseburg,OR,Other,about an hour,"i saw YHVH and afterwards there apopeared a ufo in the following week that took me from a tent and tatooed me, project blue book there.",43.2165,-123.3417
1966,Salem,OR,Oval,25 min,The pay off could be big for a little research.,44.9429,-123.0351
1966,Corvallis,OR,Disk,2 minutes,"Saucer with no sound flew 100 feet above ground, changed direction then left atmosphere in a split second.",44.5646,-123.2620
1966,Ukiah,OR,Oval,20 minutes,"Orange oval 40 ft in diameter, twenty ft off the ground, appoxumate 100 ft from me.",45.1340,-118.9325
1966,Salem,OR,Disk,"30""","Strange Orange lights seen on the same day, at the same time, thirty six years ago.",44.9429,-123.0351
1967,Lakeview,OR,Other,35 minutes,"WE SAW A QUARTER MOON SHAPED, CREAM COLORED GLOW WITH WHITE PORTHOLE LIGHTS ON BOTH SIDES",42.1888,-120.3458
1967,Myrtle Creek,OR,Circle,initially 15 minutes last,10 PM August 1967 sphere observed by multiple witnesses moving along ridgleline 1/2 mile distance 500 Lights On Object0: Yes,43.0201,-123.2931
1967,Baker City,OR,Disk,30 minutes,Disk shaped object with different colored revolving lights,44.7749,-117.8344
1967,Maury Mountains,OR,Fireball,Unknown,Possible Crashed UFO In Oregon's Maury Mountains In The Summer Of 1967.,44.0329,-120.4183
1967,Roseburg,OR,Sphere,15 minutes,"3 round craft , with red-blue-green swirling lights, ( no sound) , and sparks emitting from beneath them.",43.2165,-123.3417
1967,Chiloquin,OR,Disk,2 minutes,"It was steel gray, simigloss exterior.It was a disk. the sun was behind the horizon. It was dusk. the craft was hovering over the ri",42.5776,-121.8661
1967,Silver Lake,OR,Unknown,1minute,"Saw a small white light that increased dramatically in size, reduced to a small light, turned red and zip......it was gone.",43.1278,-121.0481
1968,Christmas Valley,OR,Disk,3-4 min.,"Step-father and his crew saw a silent, silver colored disk following (above) the power lines.",43.2378,-120.6709
1968,Eugene,OR,Cigar,3 to 5 min.,"A cigar shaped large object, that blended colors from red to white. Stayed about 3 min.",44.0521,-123.0868
1969,Portland,OR,Disk,3 MIN,WE WERE CLOSE ENOUGHT TO THROW ROCKS AT THEM WE WERE CONCERNED THAT THEY SEEN US I WAS SCARED,45.5231,-122.6765
1969,Christmas Valley,OR,Disk,5 min.,"We saw three silent silver colored disks zoom in from different directions, instantly stop, hover , and then zip off.",43.2378,-120.6709
1969,Wasco,OR,Disk,About 2 min.,I saw the craft almost stationary about 75 yards out; and 75 yards high .I looked at for about one minute then ran back to our house to,45.5918,-120.6981
1969,Portland,OR,Cigar,3/1/2002,The cigar shaped crafts unusual attitude is something I have never seen repeated with any modern aircraft past or present.,45.5231,-122.6765
1970,Ritter,OR,Disk,4 min,I was on a fishing trip with a friend . It was getting dark and we were looking upat the sky with my bionacers when i notched two white,44.8924,-119.1436
1970,Beaverton,OR,Disk,10 minutes,Will never forget.,45.4871,-122.8037
1972,Oregon City,OR,Triangle,06-10 sec,Triangular-Rounded Edges-Very Black-Rimmed evenly with small lights and unevenly on its underside.,45.3573,-122.6068
1972,Medford,OR,Light,ten minutes,Projecting-retracting-light beam from no visible source,42.3265,-122.8756
1972,Milwaukie,OR,Light,5:00,"An unseen, low-flying object was emitting a beam of light on the ground coming towards us.",45.4462,-122.6393
1972,Sweet Home,OR,Unknown,ufo,"Ligthning coming out of a cloud hovering, waves of clouds come out an going backin, no sound look at that?",44.3976,-122.7362
1973,Portland,OR,Fireball,2 minutes,"My cousin and I were laying on our backs on a hill in front of my home - at about a 30 degree angle. Looking up at the night sky, talk",45.5231,-122.6765
1973,Warm Springs,OR,Disk,30-60 secs.,"Craft with green beam over Warm Springs, Oregon",44.7635,-121.2662
1973,Roseburg,OR,Cylinder,"not sure,maybe 2 hours","We were on the outskirts of town, just passing the sewage treatment plant, when this object with blinding white light enveloped the car",43.2165,-123.3417
1974,Aurora,OR,Disk,2 minutes,Flying Saucer hovers above car.,45.2310,-122.7559
1974,Lakeside to North Bend,OR,Light,30 min.,Cone shaped light,43.5757,-124.1751
1974,Gold Beach,OR,Circle,30 seconds,Ball of light shining a cone of light on the beach.,42.4073,-124.4218
1974,Fossil,OR,Changing,55 hours,((HOAX??)) The object at a distance looked like a Ferris wheel with multiple colors of red green blue yellow.,44.9982,-120.2161
1975,Portland,OR,Disk,5 minutes,A disc shaped craft that appeared to be made of metal.,45.5231,-122.6765
1975,Little Valley,OR,Light,5 minutes,"Two headlights following the canal road, rises into the air, goes a ways, lights fade out and disappear without any sound.",43.8793,-117.4819
1976,Gresham,OR,Changing,30 minutes,"We saw ""it"" and got the hell out of there! We then came back.......and so dit it!",45.5001,-122.4302
1976,Beaver Creek,OR,Disk,one minute,Craft appears from over the top of house and stops over yard as kids are looking out the window at bed time.,45.2879,-122.5353
1976,Cave Junction,OR,Triangle,12 hours,Real man in black,42.1629,-123.6481
1976,Portland,OR,Triangle,30 seconds,The craft was low and made absolutely no noise. It had lights that ran down the left and right side of the craft. ((anonymous report)),45.5231,-122.6765
1976,Portland,OR,Triangle,20 min,"Large triangle remembered in Portland, Oregon",45.5231,-122.6765
1976,Portland,OR,Cigar,3-4 minutes,Cigar shaped object over Porland Oregon 8/76,45.5231,-122.6765
1977,Salem,OR,Cigar,15 minutes,"Slowly moving cigar-shaped object with unusual flashing lights seen in Salem, OR in 1970's.",44.9429,-123.0351
1977,John Day,OR,Oval,1 minute,Large oval orange red craft seen in John Day.,44.4160,-118.9530
1977,Winston,OR,Circle,23:00 to nightfall,"All of the above. And there is a lot more to this story, ongoing.",43.1223,-123.4126
1977,Newport,OR,Light,20+10 min,Zig-Zagging light similar to star moving around other stars changing intensity as if looping in/out light range,44.6368,-124.0535
1977,Beatty,OR,Light,5-8 min,A bright object flying in the sky turned 90 deg on the fly came toward us then glowed brightly for maybe 8 min then flew away from us a,42.4418,-121.2708
1977,Christmas Valley,OR,Formation,5 min,Strange incident in 1977,43.2378,-120.6709
1978,Medford,OR,Disk,7 or 8 mins,Inflight formation with two disk,42.3265,-122.8756
1978,Pleasant Hill,OR,Unknown,1 min,Grandfather and grandson levitated in dump truck. 500 Lights On Object0: Yes,43.9674,-122.9329
1978,Grants Pass,OR,Disk,2 hrs.,"Object landed on corner of street. Stayed there approx. 2 hours. Had red, blue, yellow, green lights along middle that spun. Approx.",42.4390,-123.3284
1978,Westport,OR,Unknown,10 sec.,"Two Stars flying parallel to one another at undescribeable speed, then stopping on a dime momentarily to only part in differant directi",46.1326,-123.3748
1978,Pendleton/Athena (between),OR,Light,several seconds,"Tourquois-green fireball drop straight down from a cloud layer and hover a few seconds. Next made a bee line to our car, then shot str",45.6721,-118.7886
1978,Sisters (near),OR,Other,possibly 4- 5 seconds,neon multi-colored jellyfish type hovering object in Oregon late 70's -first report of this incident,44.2909,-121.5492
1979,Medford,OR,Unknown,5 min,"While in flight landing at Medford from Klammath Falls, I spoted what appeared to be another aircraft flying the opposite direction. S",42.3265,-122.8756
1979,Baker City,OR,Cigar,12 seconds,"Large, cigar-shaped craft w / windows travelling south to NNE near Baker, Oregon @ appx. 22:00 on March 24th, 1979.",44.7749,-117.8344
1979,Portland,OR,Triangle,a while,If you saw the triangle I have described. It would be very wise to search your memories.,45.5231,-122.6765
1979,Clackamas,OR,Light,2 seconds,Lights in the fog,45.4076,-122.5704
1980,Bend,OR,Oval,Unknown,Oval (football shaped) with gridwork.,44.0583,-121.3153
1980,Cave Junction (outside of),OR,Unknown,5 minutes,Men In Black Encounter in Oregon,42.1629,-123.6481
1980,Gresham,OR,Sphere,5 secsonds,White orb like object heading west towards portland from gresham,45.5001,-122.4302
1980,Tillamook,OR,Rectangle,2 minutes,"It was big as a football feild with lit up windows, i could see movement inside, it was so low & slow i could see alot of detail.",45.4562,-123.8440
1980,Bandon,OR,Disk,4-8 seconds,"Father & son saw big glowing white disk approach thru clouds from S, depart thru clear sky to SW.",43.1190,-124.4084
1980,Bend,OR,Unknown,10 minutes,"Bright round object seen at night, shot upward at a 45% angle, then got dimmer and dimmer until it faded away.",44.0583,-121.3153
1981,Milwaukie,OR,Disk,30 seconds,Large blueish green disc shaped craft stopped and hovered,45.4462,-122.6393
1981,The Dalles,OR,Fireball,,"Ball of fire moving up the Columbia River. Just made a ""B"" line. No sudden movement",45.5946,-121.1787
1981,Portland,OR,Triangle,15 seconds,"elongated triangle ship spotted around 1981, 3 witnesses. it put us in a daze making it hard to think",45.5231,-122.6765
1981,North Bend,OR,Oval,4-5 mins,"My wife, my self and my two boys,ages about 13 and 9 were coming home from town. We turned off of No. Bay Dr onto No.Way, we saw what l",43.4065,-124.2243
1981,Beaverton,OR,Cigar,10 sec,"DAYTIME SIGHTING long, black, no features, like a pencil, no sound. no lights.",45.4871,-122.8037
1981,"Detroit/Warm Springs (between, Cascade Mts.)",OR,Cigar,one hour,Single small vehicle left main body and followed us in a hovering helicopter fashion for over 45 minutes while we were walking from the,44.7340,-122.1498
1981,Sherwood,OR,Other,about 15 sec,"Two flying wings (?) over Sherwood, OR night sky.",45.3565,-122.8401
1981,Sherwood,OR,Other,5 min,"I looked up in the sky, and right above me, about the height you'd see a landing airplane if you were near an airport, were two flying",45.3565,-122.8401
1982,Stewart State Park,OR,Formation,2-3 minutes,"Glowing, colored, 3 object, light formation, merging into one bright ball of white light, and then disappearing.",45.7391,-123.1996
1983,Portland,OR,Light,420,I witnessed several orb shape objects glowing bright red in Portland Oregon near SE 72nd off Harold around 8pm .,45.5231,-122.6765
1983,North Bend,OR,Oval,3-4 mins,"My wife, two kids, ages 9 and 13 and myself. We were going home east just turning from No.BAY Dr, onto No. Way. As we all looked up the",43.4065,-124.2243
1984,Eugene,OR,Triangle,10 minutes,"Large Black colored triangle shaped ship. Eugene, OR 1984",44.0521,-123.0868
1984,Bandon,OR,Rectangle,5,oregon coast rectangle football field sized white square lights,43.1190,-124.4084
1984,Waldport,OR,Light,10 minutes,Bright light of a fast moving craft frightened me in the night on the Oregon Coast.,44.4268,-124.0687
1985,Hermiston,OR,Other,45 seconds,"Me and my buddies were out camping, when we heard a muffled bang. We looked up and there was three bright flashes of blue light, then 3",45.8404,-119.2895
1985,Portland,OR,Light,15 mins,multiple points of light hovering? over the west hills of Portland that could disapear one at a time while I was watching them,45.5231,-122.6765
1985,Portland,OR,Light,10-15 mins,multiple points of bright light seen above city apparently motionless then dissapeared one by one.,45.5231,-122.6765
1985,Prineville,OR,Other,15 minutes,Small silver pyramid object just above the power lines observed for about fifteen minutes in the mid 80's,44.2998,-120.8345
1985,Cottage Grove,OR,Sphere,10 sec.s,"Orange ""golf ball"" ufo's fly over Dorena Lake.",43.7976,-123.0595
1985,Pendleton,OR,Rectangle,3 minutes,rectangle falling turning and flipping end over end,45.6721,-118.7886
1986,Newberg,OR,Triangle,30 min,"tranguler sighting on the west coast , lights , fast moving at times and chased by the airforce",45.3001,-122.9732
1986,Klamath Falls,OR,Circle,45 minutes,"BRIGHT OBJECT DROPPING ""FIRECRACKERS"" FROM IT - IT SEEMED TO KNOW I COULD SEE IT - VANISHED IN A TYPE OF EXPLOSION",42.2249,-121.7817
1986,Salem,OR,Cigar,25 minutes,Very Close Encounter.,44.9429,-123.0351
1987,Salem,OR,Sphere,,"Woman repts. past sighting of perfectly round, red globe floated across city. 2nd one appeared. Witnessed by reporter, too.",44.9429,-123.0351
1987,Seal Rock,OR,Sphere,Seconds,My wife and I are professional photographers and were doing some stock photo work at Seal Rock on the Oregon coast. I still don't know,44.4972,-124.0827
1987,Coos Bay,OR,Disk,1 hour,Dome type object went straight up with a little round object along side and below.Object kept moving up and down side to side and chang,43.3665,-124.2179
1987,Springfield,OR,Cigar,4 minutes,Cigar Shaped and extremely close,44.0462,-123.0220
1987,Roseburg (7 miles northwest of),OR,Oval,30 mins.,Two small glowing oval orange objects and one larger triangle craft in rural Oregon.,43.2165,-123.3417
1988,Clackamas,OR,Cylinder,45 seconds,"I know ""ancient history"" is frowned upon,but here goes.I've been around aircraft(experimental or otherwise) all my life,and nothing com",45.4076,-122.5704
1989,Baker City,OR,Unknown,10 - 15 minutes?,Two humanoid shapes visible inside lit window of craft.,44.7749,-117.8344
1989,Hebo,OR,Sphere,10-15 seconds,"Ball of orange light over Mount Hebo, OR",45.2293,-123.8595
1989,Beaverton,OR,Cylinder,10-20 seconds,Large cylinder seen at low altitude during daylight in urban area.,45.4871,-122.8037
1989,The Dalles,OR,Triangle,30 minutes,"I was watching a single light such as an airplane might do when it is coming at you, but it didn't move it just sat there, it was about",45.5946,-121.1787
1989,Redmond,OR,Triangle,10 to15 sec,It's been a long time since and have never officially reported it to anyone. I've talked about throughout the years. I use to fight Fo,44.2726,-121.1739
1989,Wolf Creek drainage (N of Hwy. 26),OR,Sphere,30 min,"We both saw a spherical glowing flying object come out of the west, head for Portland and get chased back by three fighter aircraft.",42.6954,-123.3953
1989,Glennwood,OR,Sphere,1 Minute,A brightly lit perfectly round sphere floated in front of the car at a traffic signal.,44.0444,-123.0336
1990,Eugene,OR,Light,3minutes,three vertical red lights in the sky,44.0521,-123.0868
1990,The Dalles,OR,Triangle,20 minutes,"Triangle shaped with lights moving slowly, no sound",45.5946,-121.1787
1990,Springfield,OR,Oval,20 min,orange ballon dripping sparklers,44.0462,-123.0220
1990,Willamina,OR,Rectangle,2 min,RAINBOW PHOTO IN OREGON SHOWS TRIANGLE OBJECT IN SKY.,45.0787,-123.4859
1990,Mt. Hood,OR,Sphere,11 seconds,"From a fixed point, the object zigzad north and south, covering a 16 miles distance in no more than a second or two.",45.3736,-121.6960
1990,Prineville (30 miles east of),OR,Light,about 4-6 seconds,Fast moving ball of light that can move at right angles.,44.2998,-120.8345
1991,Detroit,OR,Light,30 sec,"small flash, streak of light, light stopped, then went other way slowly.",44.7340,-122.1498
1991,Albany,OR,Egg,10-15 minutes,three black egg shapes,44.6350,-123.1059
1991,Mt. Hood,OR,Circle,3 seconds,"I saw a round object in a controlled fall from the sky, the obje went behind some clouds and did not reappear in its fall.",45.3736,-121.6960
1991,Grants Pass,OR,Light,8 hrs,Light appeared over mountain,42.4390,-123.3284
1991,Portland,OR,Cigar,1 minutes,It was a long cigar shaped object; no way its some thing we built.,45.5231,-122.6765
1992,Grants Pass,OR,Light,10 minutes,Going across sky. Thought it was airplane at first...until it started melting.,42.4390,-123.3284
1992,Lakeview,OR,Disk,5 minutes,Close to a mile wide saucer with windows seen in Southern Oregon in 1992 at dusk..,42.1888,-120.3458
1992,Tigard,OR,Unknown,1-2 minutes,"Lights 8-10 'v' shaped gliding across sky, no sound, gigantic, blacked out sky so no stars or planes could be seen.",45.4312,-122.7715
1992,Wilsonville,OR,Light,15 sec.,"Woman repts. seeing ""round, flashing lights"" moving S to N while in hospital.",45.2998,-122.7737
1993,Tillamook(Lees Camp),OR,Light,15 minutes,"we saw 3 lights ahead of us,aprx. 2000 ft up ,hovering above the mountain(north)we watched for aprx. 5 min.i look to my left(west) i sa",45.4562,-123.8440
1993,Lake of the Woods (Near; closest city Ashland - 30 mi.),OR,Light,30-45 min,"3 luminous objects moving extremely fast, instant directional changes, changed color My parents and I were observing the Perseid met",42.3787,-122.2122
1993,Portland,OR,Disk,15 seconds,No lights or sound 300 or 400 feet long looked like brushed aluminum saw it 1 or 2 miles away then vanished away.,45.5231,-122.6765
1993,Sandy,OR,Disk,15 seconds,2 saw it.,45.3973,-122.2615
1994,Mitchell,OR,,2 sec.,Two men observed a blue/white object streak down and disappear behind a nearby ridge. Cast light.,44.5665,-120.1533
1994,Portland,OR,Sphere,10 minutes,While in light aircraft observed object below and behind follow in a race track holding pattern. Observed changes in heading altitude a,45.5231,-122.6765
1994,Bend,OR,Disk,3.5 hours,it came up to us as fast as it left us and shined us hard with white/blueish lights. lots of energy felt...and wind,44.0583,-121.3153
1994,Drain,OR,Light,3-5 min.,"Large circle of light in the sky flashes brightly, then shrinks to star size and zig-zaggs away.",43.6587,-123.3187
1994,Oregon City,OR,,,Young woman reports sighting. (Facts unclear; awaiting written rept.),45.3573,-122.6068
1994,Canby,OR,,,"OR Air Nat. Guard Publ. Affairs Officer relays past sighting: Citizen reports sighting obj. ""size of football"" in sky.",45.2623,-122.6921
1994,Hillsboro,OR,Cigar,2 minutes,"Working in my garden, looked up and saw a cigar shaped craft proceeding south. It was very high and I didn't hear or expect to hear an",45.5229,-122.9898
1994,Hillsboro,OR,,1:00 min,"Driving down a busy street in Hillsboro,an acorn shaped craft caught my eye. I looked at the road and it disappeared.",45.5229,-122.9898
1994,Boring,OR,,,OR Air Nat. Guard Publ. Affairs Officer relays 2nd past sighting rept.: Citizen repts. UFO. (Facts not provided.),45.4314,-122.3735
1994,Grants Pass,OR,Changing,12 hours,"Thought of as a Dream for 20 Years, Recent Information Convinced me that Iv been Abducted by Aliens.",42.4390,-123.3284
1994,Sitka,OR,Oval,1 minute,"Small, silver, oval, about 1/2 mile out over bay, accelerated at enormous speeds, disappeared",57.0531,-135.3300
1994,Molalla (near),OR,Other,3 minutes,"black object in sky traveling above river, circle of light appearing to come from it lighting up river in just that area of light",45.1473,-122.5770
1995,Gladstone,OR,Triangle,,Woman witnessed triangular ship w/ white & blue lights. She & neighbors witnessed 5 ships. Reported mil. jets in area.,45.3807,-122.5948
1995,Beaverton,OR,,,Mother & daughter witness strange shafts of green light that appear to move around clouds. Second sighting.,45.4871,-122.8037
1995,Bend,OR,,73 min.,Woman observes three strange objects hovering in morning sky for 73 minutes. Very bright lights. Good rept.,44.0583,-121.3153
1995,Portland,OR,,15 min.,Man out walking during early morning observes three very colorful objects in southwest sky. They move.,45.5231,-122.6765
1995,Tidewater,OR,,,"Mother & son witness ""star,"" which began to move, first north, then south. No radar contact reported.",44.4112,-123.9004
1995,Tillamook,OR,,,"Woman witness very bright red, white, and blue light south of town. ""Like triangle.""",45.4562,-123.8440
1995,Cannon Beach,OR,,10 sec.,"Man in motel room sees ""flash of red light in eyes."" Sees bright light in room. Sees bright ""star"" below overcast to south.",45.8918,-123.9615
1995,Sprague River,OR,,,"Man was going to bed and noticed ""moving star."" Object appeared large, and was dipping and weaving. Disappeared",42.4554,-121.5042
1995,Portland,OR,,40 min.,"Man repts. strange green light behind clouds. Seemed to generate ""ripple"" effect in atmosphere.",45.5231,-122.6765
1995,Florence,OR,,,"Man called to report that he and his daughter had been followed in their car by a huge, bizarre obj. Est. width was 450 feet!",43.9826,-124.0988
1995,Portland,OR,,15 sec.,"Woman sees four bright lights moving across sky, w/ red, flashing light on tail. Loud sound. Flew south.",45.5231,-122.6765
1995,Portland,OR,,,"Man witnessed four lights on dark ship, w/ red blinking light on tail. Heard sound like ""blimp."" Other repts.",45.5231,-122.6765
1995,Portland,OR,,2 sec.,"Man witnessed bright obj. ""like ice cream cone"" streak across sky above city in arc path. F-16's reported.",45.5231,-122.6765
1995,Molalla,OR,,10 min.,"Young woman on rural road witnesses strange, bright obj.. Round on top, pointed on bottom.",45.1473,-122.5770
1995,Florence,OR,,15 min.,Man calls to rept. lengthy sighting over city. Sends newspaper article. Reported by many to local police.,43.9826,-124.0988
1995,Eugene,OR,,,Man reports strange flash of light struck hood of his car. No sighting of object.,44.0521,-123.0868
1995,Albany,OR,Other,1 or 2 minutes,There were bright bursts of color in a concentrated area of cloud for a couple of minutes.,44.6350,-123.1059
1995,Newport,OR,,,"While looking at stars, man sees ""satellite."" 2nd obj. streaks up to 1st, merges w/ it. Then, 3rd obj. streaks up to 2 others.",44.6368,-124.0535
1995,Oregon City,OR,,1 hour,Woman repts. two objects in proximity; witnessed two nights sequentially in same part of sky. (Possible stars??),45.3573,-122.6068
1995,Portland,OR,,,"Woman in hammock witnesses brightly lighted ""red ball"" descend from sky, fly into garage! Ascends, flies to 2nd obj. in sky.",45.5231,-122.6765
1995,Beaver Creek,OR,,30 min.,"Five witnesses rept. observing strange light in eastern sky. Saw it on 21FE and 22FE, as well. (Possible star?)",45.2879,-122.5353
1995,Portland,OR,,75 min.,"Man, lying on bed, sees very bright ball of light enter apt.. Could feel heat from obj., felt paralyzed. Loud humming above",45.5231,-122.6765
1995,Lebanon,OR,,,"Woman repts. seeing two large, bright objects, like ""funnels of light,"" in eastern sky from top of Snow Peak.",44.5365,-122.9070
1995,Gresham,OR,,10 sec.,"Man repts. very clear sighting of a very bright disc, below clouds flying from SW sky. Made zig-zag movements, flew off.",45.5001,-122.4302
1995,Starkey,OR,,20 min.,"Experienced logger repts. three very bright lights in morning sky. Middle one rises, accelerates into distance; others follow!",45.2215,-118.4258
1995,Dayton,OR,,,"Man reports witnessing ""diamond shaped"" object in sky. (Facts incomplete.)",45.2207,-123.0762
1995,Portland,OR,,5 min.,"Man repts. seeing silver flash, then sees silver, shiny craft w/ thin fuselage, but no wings! Drifted off, disappeared from sight.",45.5231,-122.6765
1995,Lake Oswego,OR,,30 min.,"Woman sees bizarre disc outside house. Looked like ""red/orange circle w/ blurred edges.""",45.4207,-122.6706
1995,W. Salem,OR,,20 min.,Man w/ two brothers witness 7-8 discs at high altitude. One obj. larger than others. Multiple calls to 911; MUFON investigating.,44.9504,-123.0701
1995,Eagle Creek,OR,,45 sec.,"Comm. pilot/ATP (14k hrs.) witnesses large, extremely bright, flaming obj. descend steeply in W sky. Dramatic. Good rept.",45.3575,-122.3589
1995,Madras,OR,Other,3-3 1/2 hours,We were possibly abducted by a pyramid shaped UFO? while traveling in eastern oregon.,44.6335,-121.1295
1995,Hillsboro,OR,,,"Man repts. ""huge"" flaming obj. w/ enormous flaming tail descend at 60 deg. below horizontal. Obj. appeared to burn out.",45.5229,-122.9898
1995,Drain,OR,Circle,est. 5 min.,Bright light flashes and shrinks before zipping off.,43.6587,-123.3187
