2000,Portland,OR,Light,3+ min.,"bright light moving South to North, then turns due East over Portland, Or. Above airliner traffic, and faster.",45.5231,-122.6765
2000,Florence,OR,Light,2 hrs,"Sighting of two brilliant orbs of light over ocean in Florence Oregon, August 2000",43.9826,-124.0988
2000,Molalla,OR,Disk,1+min.,"observed a disc shaped object hovering above me, which accelerated to the East at a highe rate of speed covering 140 degrees in 3 secon",45.1473,-122.5770
2000,La Pine,OR,Disk,2 minutes,"My daughter and I were driving down a rural road on the way home at about 7:35 p.m. on August 8th, 2000. She looked up at the moon whi",43.6704,-121.5036
2000,Elkton,OR,Changing,appr. 3 hrs.,"four objects seen at roughly 45 min. intervals, all different. All bright and moving. Came roughly from the S' and S'E'.",43.6376,-123.5682
2000,Portland,OR,Unknown,2-3 minutes,"Bright light at high altitude, weaving from side to side",45.5231,-122.6765
2000,Portland/Boise (between),OR,Other,1.5 hrs.,"Wife and adult kids in two cities at same time confirm visible energy waves radiating down from the north, many pulses. pattern?",45.5231,-122.6765
2000,Portland,OR,Sphere,5 min,"I WAS AT WORK, WENT OUT AT 3:05 PM FOR MY AFTERNOON BREAK. NO ONE ELSE HAD COME OUT FOR BREAK, SO I WAS BY MYSELF. I SAT BACK IN MY CH",45.5231,-122.6765
2000,Portland,OR,Other,45 seconds,"Early morning sighting of two red, square shaped objects preceded by a deep rumbling.",45.5231,-122.6765
2000,Trout Creek Recreation,OR,Light,2 minutes,"A bright large round light that moved in horizontal, vertical and circle, and left in rapid speed.",43.9271,-118.9399
2000,Government Camp,OR,Light,5 minutes,Chrome Orange light circles campsite,45.3040,-121.7548
2000,Eugene,OR,Changing,one hour,"I saw erratic, colored lights in the sky last night",44.0521,-123.0868
2000,Steens Mountains,OR,Unknown,2 hours,"From a remote mountain top in the desert, observed a red strobe light surrounded by many other lights creating specific patterns.",42.6364,-118.5767
2000,Portland,OR,Triangle,2-3 minutes,Triangular shaped object viewed through a telescope after initial sighting by 4 adults.,45.5231,-122.6765
2000,Eugene,OR,Other,20 seconds,"Late Fall, 2000: Eugene OR Bowl / Cone Two-Part UFO Sighted in Broad Daylight",44.0521,-123.0868
2000,White City,OR,Circle,5:00 AM,when it deposited the object into the maounten the bottom one flashed,42.4316,-122.8354
2000,Prineville,OR,Unknown,1 hour,"bright white light the size of a distant star that made eratic movements, and complete stops",44.2998,-120.8345
2000,Eugene (west of),OR,Light,3-5 min.,Lights over the Oregon Coastal Mountains.,44.0521,-123.0868
2000,Portland,OR,Light,0:03,4 white lights initially stationary suddenly merged into one light and then when out.,45.5231,-122.6765
2000,Portland,OR,Circle,3 minutes,"Many, many,many. WOW!",45.5231,-122.6765
2000,McMinnville,OR,Cigar,5 minutes,Long white cigar shaped object seen over McMinnville Oregon heading south,45.2101,-123.1987
2000,Bend,OR,Circle,5 minutes,Clear blue sky. Object was in the air hovering not moving. Round with a red steady light on the bottom of the craft. Black in color.,44.0583,-121.3153
2000,Eugene,OR,Light,8sec.,"What appeared to be a falling star , changed it's mind and made a hairpin u-turn and shot back up the way it came.",44.0521,-123.0868
2000,Bend,OR,Light,25 minutes,"Red pulsating orb over the center of Bend, Oregon. Multiple witness reports to 911.",44.0583,-121.3153
2000,Bend,OR,Circle,2-3minutes,"Round silvery object above city, possibly car size mylar balloon,seen from a few miles away slowly ascended till out of sight.",44.0583,-121.3153
2000,Portland,OR,Circle,1min/20sec,sequenced flurry of circles,45.5231,-122.6765
2000,Brownsville,OR,Circle,3 to 4 seconds,I saw a small amber light traveling from east to west,44.3935,-122.9848
2000,Chiloquin,OR,Other,2 minutes,Large boomerang shaped aircraft,42.5776,-121.8661
2000,Astoria,OR,Light,2 sec,Point source of light making abrupt changes in direction captured on video,46.1879,-123.8313
2000,Eugene,OR,Circle,.08 sec.,Brilliant White light seen traveling N to S along the,44.0521,-123.0868
2000,Sherwood,OR,Triangle,2 or 3 mins.,"Saw very low flying, quite or HUGE object with 5 big bright lights in a V shape, evenly spaced. No strobe nor colored flashing lights.",45.3565,-122.8401
2000,Beaverton,OR,Triangle,20 seconds,"Triangle shaped, 3 lights, at night, gliding over the city, seemed transluscent in a way",45.4871,-122.8037
2000,Corvallis,OR,Fireball,20 minutes,"A bright spherical object moved across the sky in daylight, then appeared to split into multiple bright lights.",44.5646,-123.2620
2000,Portland,OR,Light,2 minutes,Object was motionless and did not emit sound while motionless in the western sky.,45.5231,-122.6765
2001,Portland,OR,Sphere,20 seconds,"As my daughter and I were headed home from the store it was dark, cloudy, and raining hard. We turned a corner and right ahead but not",45.5231,-122.6765
2001,Molalla,OR,Light,continuing,"Now 20 minutes....extremely bright, non-moving light, hovering low, no way to guess altitude nor distance (after dark) but in a pla",45.1473,-122.5770
2001,Hillsboro,OR,Fireball,few seconds,Happened to glance over to the southwest part of the sky from my backyard and saw a very bright and very green fireball heading at an a,45.5229,-122.9898
2001,Newport,OR,Light,5 seconds,Two parellel luminescent lights decended from sky and vanished over ocean without sound.,44.6368,-124.0535
2001,Portland,OR,Other,three seconds,I saw a very low-flying and large craft without lights or sound in a northerly direction.,45.5231,-122.6765
2001,Corvallis,OR,Fireball,2 seconds,Fireball ?,44.5646,-123.2620
2001,Keizer,OR,Triangle,1 minute,"While observing a cluster of ""stars"" three stars swooped down and headed south at a great rate of speed.",44.9901,-123.0262
2001,Amity,OR,Disk,HOURS,"PLEASE HELP US FIND OUT WHAT WE ARE SEEING IN OUR SKY THAT THE LOCAL UFO HOT LINE DIDN,T FEEL LIKE TALKING TO US ABOUT.",45.1157,-123.2073
2001,La Pine,OR,Rectangle,5 mins,I just got to school when I looked up I saw it the school is shaped like a U there were no sounds from the engines it was flying low th,43.6704,-121.5036
2001,Clackamas,OR,,7 sec,"Shooting Star, Meteor, or ?",45.4076,-122.5704
2001,Portland,OR,Light,1 hour,What I thought was venus was moving !,45.5231,-122.6765
2001,Medford,OR,Triangle,at least 40 mins. I went,Bright flickering light in southwestern sky.,42.3265,-122.8756
2001,Cottage Grove,OR,Disk,7 minutes,they were glowing disk shaped objects,43.7976,-123.0595
2001,Springfield,OR,Circle,1minute,"I viewed a moving object, traveling southwest and it split-up into two moving objects, exchanging a red light beam.",44.0462,-123.0220
2001,Portland,OR,Oval,1-2 minutes,"Brightly lit, kind of glowing, oval shaped, object moving at a steadily paced speed across the sky.",45.5231,-122.6765
2001,Cottage Grove,OR,Changing,5 hours,The object changed shapes and turned different colors.,43.7976,-123.0595
2001,Grand Ronde,OR,Disk,driving to mcminville,My name is ((deleted)) and I have just seen a U.F.O.Iwas going to Mcminville and I looked out the window and saw a shiny disk ty,45.0601,-123.6093
2001,Rogue River,OR,Disk,15 to 20 min.,"It started about 8:30 pm or so went by sliding door and saw a bright light, I thought that that was strange too see a plane with it's l",42.4360,-123.1720
2001,Rogue River,OR,Disk,15 to 20 min,I saw a disk or saucer and it was glowing.It made the sky brighter than what the sky usually is.It also looked like it had a beam comin,42.4360,-123.1720
2001,Rogue River,OR,Diamond,10 minutes,Bright diamond shape light at first it didn't move. Then it started getting lighter and brighter and smaller and bigger. Then it star,42.4360,-123.1720
2001,Rogue River,OR,Diamond,10 minutes,The shape of the craft was a diamond.The craft had circular lghts that were bright.It had a glare coming from the craft that was grayis,42.4360,-123.1720
2001,Rogue River,OR,Diamond,10 minutes,"Bright diamond shape light nortwest sky right sbove a ridge line in the bac of our house, we wacthed the light pull apart from the side",42.4360,-123.1720
2001,Corvallis,OR,Unknown,three seconds,"Not a shooting star, not an aircraft, quiet, green, large, and materialized out of thin air.",44.5646,-123.2620
2001,Portland,OR,Chevron,2-3 minutes,2 V-shaped objects with bright lights seen near NW Portland.,45.5231,-122.6765
2001,Chiloquin,OR,Triangle,"2min,4min",Three UFO's seen flying over the Klamath sky.,42.5776,-121.8661
2001,Gates,OR,Triangle,2 minutes,Triangles seen flying in thin layer of clouds.,44.7562,-122.4167
2001,Portland,OR,Sphere,10 minutes,100 or so golden spheres hovering and moving up and down in a corkscrew fashion in bright sun.,45.5231,-122.6765
2001,Beaverton,OR,Light,5 min,3 people saw 3 flickering orange lights moving slowly away from each other.,45.4871,-122.8037
2001,Beaverton,OR,Light,10 minutes,"3 Red nocturnal ""visitors"" seen in Washington County Skies.",45.4871,-122.8037
2001,Wagontire,OR,Flash,15-30,"No, aircraft I am aware of can accelerate horizonally like this..",43.2497,-119.8765
2001,Beaverton,OR,Light,ten minutes,"I saw three, big yellow lights in the south that didn't move.",45.4871,-122.8037
2001,Beaverton,OR,Light,5 min,"3 ligkts seen floating up Hwy 26 at aprox. 9:30 PM, looked kinda orange and connected to each other!",45.4871,-122.8037
2001,Roseburg,OR,Unknown,10 minutes,"Large object travelling North. 2 Large Yellowish Bright lights and other lights on object. NO SOUND. Alt. <2000 feet, vel. <100mph",43.2165,-123.3417
2001,Klamath Falls,OR,Flash,20 minuts,two flashing red lights moving around eachother.,42.2249,-121.7817
2001,Rockaway Beach,OR,Unknown,3-4 min.,Weird lights over Oregon Coast,45.6134,-123.9429
2001,La Pine,OR,Triangle,2 -3 minutes,Dark triangle with strange strobing lights seen south of bend Oregon 21 mach 22:30 PST moving slowly at first then acelerating to the S,43.6704,-121.5036
2001,Eugene,OR,Fireball,2.5 seconds,Fireball of bright white light traveling from South to North.,44.0521,-123.0868
2001,Salem,OR,Other,20,"looked like satalight's but they were not,,",44.9429,-123.0351
2001,Corvallis,OR,Fireball,6-8 seconds,Fireball Sighted by Child in the Northwest,44.5646,-123.2620
2001,Portland,OR,Fireball,about 3 min.,"Immediately following a very loud, sharp explosion there was a large burst of flame in the sky, followed by dark smoke. of",45.5231,-122.6765
2001,Portland,OR,,2-5 min.,"Woman reports hearing sharp explosion, witnessing fireball, and seeing smoke over north Portland.",45.5231,-122.6765
2001,Scappoose,OR,Triangle,10 minutes,"UFO 1/10 of a mile away seen for 10 minutes in Scappoose, Oregon",45.7543,-122.8776
2001,Sunriver,OR,Triangle,15 - 20 Minutes,"""VERY LARGE"" Triangular shaped vehicle moving at a very fast steady speed NW to SE blocking out stars as it went.",43.8694,-121.4334
2001,Aloha,OR,Diamond,12 min,Slow moving orange dimond.,45.4943,-122.8670
2001,Hillsboro,OR,Light,1hr+,"3 of us watched UFO for over 1hour by Hillsboro, Oregon last night instead of the Sapranos! very bright flashes and rainbow effects!",45.5229,-122.9898
2001,Hillsboro,OR,Light,20 minutes,"Strange light in Hillsboro, OR (1 week after same type of sighting reported in Hillsboro by other witnesses.)",45.5229,-122.9898
2001,Salem,OR,Other,25 mins,3 Extraordinary close Ufo encounters!!!!!!!!!!!!,44.9429,-123.0351
2001,North Plains,OR,Triangle,1 minute,"Big, black, silent,3 lights at each corner,triangle,wider then a 4 lane free way.",45.5971,-122.9934
2001,Eugene,OR,Light,witnessed for about 5 min,a stationary pulsing/flickering light randomly changing from white to orange.,44.0521,-123.0868
2001,Gresham,OR,Circle,5-10 minutes,"Bright circular object seen moving in a South to North direction fading in and out of sight, and difficult to pick up by binoculars.",45.5001,-122.4302
2001,Amity,OR,Light,hours,strange lights in evening sky,45.1157,-123.2073
2001,Hillsboro,OR,Light,8-10 seconds,"I had just exited a residence and happened to look up into the sky as it was a very clear night. Upon turning my eyes skyward, a very b",45.5229,-122.9898
2001,North Bend,OR,Light,ten seconds,Bright light coming from the sky with no sound of any aircraft or hellicopters.,43.4065,-124.2243
2001,Portland,OR,Oval,12:07,"I heard a helicopter which sounded like it was above my house, I went outside to see and I looked at the helicopter, it had a sheriff s",45.5231,-122.6765
2001,Grants Pass,OR,Teardrop,30sec.,large tear shape object flying north to south,42.4390,-123.3284
2001,Grants Pass (Murphy Area),OR,Egg,Seconds,"Large egg shape UFO, solid (no blinking lights) white light with blue tones in it. The UFO was traveling north to south at a very high",42.4390,-123.3284
2001,Irrigon,OR,Cigar,45 seconds,Very Large cigar/cone shaped object witnessed over Columbia River.,45.8957,-119.4914
2001,Eagle Point,OR,Other,10 seconds,Silent flaming yellow-green object,42.4726,-122.8028
2001,Portland,OR,Unknown,5-10 minutes,Observed object in Clackamas- Oregon City area.,45.5231,-122.6765
2001,Barview,OR,Triangle,2-3 minutes,"Large, triangular shaped object, three points of fient light as if stars.",43.3543,-124.3132
2001,Hillsboro,OR,Light,5 seconds,"Big, bright, white, light receding quickly from view.",45.5229,-122.9898
2001,Portland,OR,Changing,20 minutes,"In bright daylight, bright object observed-thru binoculars it looked wierd-second bright object traversed path of first.",45.5231,-122.6765
2001,La Pine,OR,Fireball,30 seconds,UFO enters atmosphere in fireball and flys away erratically.,43.6704,-121.5036
2001,Eagle Point,OR,Sphere,5 Minutes,Disappeard and reappeared in nonsequential order.,42.4726,-122.8028
2001,Langlois,OR,Cigar,60 seconds,"A long rocket like cigar with ""fins"" attached to it's body flying in a seemingly upward pitch.",42.9237,-124.4500
2001,Wilsonville,OR,Triangle,5 minutes,"Slow moving, quiet, dark object wandered up and to the South, avoiding a big cloud.",45.2998,-122.7737
2001,Wilsonville,OR,Triangle,5 min,"Black rounded corner pyramid, or triangle moving slowly without lights, sound, or visible means of propulsion, Wilsonville, OR.",45.2998,-122.7737
2001,Oregon City,OR,Triangle,15:00 min,Spoted craft at a low altitude southwest of town . It appeared to be traveling about sixty miles per hour . As the craft got closer I w,45.3573,-122.6068
2001,Gresham,OR,,,Round mark,45.5001,-122.4302
2001,Salem,OR,Light,5 minutes,red light in southern sky,44.9429,-123.0351
2001,Hillsboro,OR,Oval,3min,"Orange satillite enlarges 5 times its size as it flairs to white-blue, then back to original size and color .",45.5229,-122.9898
2001,Portland,OR,Light,30sec.,light bright to dim and gone,45.5231,-122.6765
2001,Ontario,OR,Light,530,"Two bright lights seen North East of Ontario, Oregon.",44.0266,-116.9629
2001,Beaverton,OR,Circle,90 seconds,"Dark circle, or Dot at about 1,000 ft. moving due South to North, at small plane speed at 09:19, with a bizzare field that shimmered...",45.4871,-122.8037
2001,Portland,OR,Chevron,30 minutes,"bright as a red flare , chevron shaped, silent, 1000 ft over my house and stayed for 30 min..caught on video tape.",45.5231,-122.6765
2001,Portland,OR,Sphere,15 min,slow moving bright red shere under low cloud deck.,45.5231,-122.6765
2001,Molalla,OR,Chevron,10 seconds,"3 Triangular craft in a formation south to north, emitting a whirring sound and displaying 4 white lights each.",45.1473,-122.5770
2001,Corvallis,OR,Other,3min.,I have had 4 close sightings over the past 5yrs.,44.5646,-123.2620
2001,Mulino,OR,Light,30 seconds?,"Bright light moving from west to east stops and appears to shoot straight up, disappearing.",45.2212,-122.5817
2001,Portland,OR,Other,15 MINUTES,US Shuttle being followed?,45.5231,-122.6765
2001,Grants Pass (Murphy Area),OR,Light,Several minutes,Large bright light traveling low at a slow rate of speed with no sound,42.4390,-123.3284
2001,Portland,OR,Fireball,5-7sec,ball of light_w/aura shoots across portland/ nitesky....no story at 11:00,45.5231,-122.6765
2001,Portland,OR,Sphere,5 minutes,Daytime UFO sighting over Portland Oregon,45.5231,-122.6765
2001,Sisters (7 miles SW of),OR,Light,2 minutes,2 identical objects seen at high altitude.,44.2909,-121.5492
2001,Salem (Outside),OR,Light,10mins,Yellowish light pulsating in the night sky,44.9429,-123.0351
2001,Medford,OR,Other,5 minutes,It was a bright light looked like a really bright star. It was going east floating slowly then it turned south east and zig zagged sli,42.3265,-122.8756
2001,Keizer,OR,Triangle,5 - 6 Minutes,Watched 3 lights in a triangle formation travel slowly and silently west to east across the night sky.,44.9901,-123.0262
2001,Milwaukie,OR,Formation,2min,"2 bright red lights blinking very fast one on top and one on botom, the lights went on for about 20-30sec. then instantly lights stoped",45.4462,-122.6393
2001,Lorane,OR,Circle,90 sec.,"Round glowing blue object moving very fast, changing directions twice",43.8376,-123.2390
2001,The Dalles,OR,Triangle,20 minutes,"Stationary grounded object north of Dallesport, Wash. Bright silver in sunlight.",45.5946,-121.1787
2001,Springfield,OR,Oval,,"It is an oval shaped object. Starting from left to right, there is a White-Hazy light, then 1 red light, then 4 green lights, then ano",44.0462,-123.0220
2001,Columbia City,OR,Light,1 minute,a light form ripping around the sky,45.8901,-122.8070
2001,Florence,OR,Circle,30 seconds,Bright red fire ball in front yard,43.9826,-124.0988
2001,Eugene,OR,Triangle,5 seconds,Big triangle of stars crosses sky.,44.0521,-123.0868
2001,Salem,OR,Flash,1 minute,Four stationary bright flashes in the constellation of the Swan,44.9429,-123.0351
2001,Eugene,OR,Sphere,1 minute,"Round, changed color, swerved, reversed direction without turning or stopping.",44.0521,-123.0868
2001,McMinnville,OR,Unknown,<2 minutes,"Non-flashing, eratic behavior, disapeared into sky",45.2101,-123.1987
2001,Lincoln City,OR,Light,1-2 minutes,"Orange/bronze flare of light over ocean, not moving.",44.9582,-124.0179
2001,Hillsboro,OR,Changing,17:56,triangular object(s) coasted through Oregon and Washington.,45.5229,-122.9898
2001,Portland,OR,Formation,4-5 seconds,Wedge formation of 5 round (or disc) shaped objects glowing pale green flying north incredibly fast on 9/30/01 @ 7:15PM over Portland,45.5231,-122.6765
2001,Polk County,OR,Unknown,2 minutes.,Close encounter over roof in Polk County - submitted by OUFOR.,44.9267,-123.4919
2001,Klamath Falls,OR,Light,5 minutes,"Bright blue fireball, no train, then odd , slow movement in opposite direction of multi-lit object",42.2249,-121.7817
2001,Springfield,OR,Fireball,3sec,Going West to East I saw what was the beginning of a meteor breaking up and did not get a confirmation from my nearest airport as to a,44.0462,-123.0220
2001,Roseburg,OR,Light,15 min,A red light to the north kinda a mass of light seen. leaves lots of people wondering,43.2165,-123.3417
2001,Florence,OR,Unknown,9 Miles,Pulsating light follows car 9 miles in Oregon,43.9826,-124.0988
2001,Tualatin,OR,Triangle,30 seconds,UFOs on The Night of The Shooting Stars,45.3840,-122.7640
2001,Portland (suburbs),OR,Light,15 minutes,"Two objects joined, then split apart and one released a small light.",45.5231,-122.6765
2001,Portland,OR,Triangle,5 minutes,Triangle shaped object drops from sky during meteor shower...possible abduction.,45.5231,-122.6765
2001,Cornelius/North Plains area,OR,Rectangle,15 seconds,"Large, low-flying rectangular object sighted 11/19 at 9:45 PM",45.5198,-123.0598
2001,Milwaukie,OR,Fireball,0.02 sec,High speed moving fireball fallow by a bright tail .,45.4462,-122.6393
2001,Grants Pass,OR,Triangle,5 minutes,"Very large triangular shaped UFO siting, North-West, outlined in blinking red lights",42.4390,-123.3284
2001,Astoria,OR,Sphere,5 minutes,"Eight small, silver- colored spherical objects over Columbia River",46.1879,-123.8313
2001,Portland,OR,Light,1 hour +,"a flickering light, that changed color, and greww larger and started to throb when airplanes came near.",45.5231,-122.6765
2002,Springfield,OR,Teardrop,45 seconds,Rain drop shaped with windows.,44.0462,-123.0220
2002,Portland,OR,Light,1 minute,"Sighting of lights over willamette river in Portland, OR Saturday 1/12/02 @ 4:10pm near two rainbows",45.5231,-122.6765
2002,Portland,OR,Triangle,2 minutes,Red triangles of light that straightend into column.,45.5231,-122.6765
2002,Portland,OR,Light,2 minutes,"Red, fuzzy ball of light streaking across in front of the mountain.",45.5231,-122.6765
2002,Salem,OR,Triangle,5-10 min,triangle shape ufo N salem,44.9429,-123.0351
2002,Eagle Point,OR,Light,1 minute,Orange lights traveling slowly across sky fade out and diminish in size,42.4726,-122.8028
2002,Portland,OR,Disk,60 minutes +,"Craft forms Triangle, becomes portal right over 1-5",45.5231,-122.6765
2002,Portland,OR,Disk,30 seconds,Oregon UFO Review Case: Disk w/dull reddish glow.,45.5231,-122.6765
2002,Canby,OR,Light,3 min.,"Two white lights traveling north at a highe rate of speed, hovering =, then continuing north",45.2623,-122.6921
2002,Merlin,OR,Circle,20 min,strange light that changed all colors in the sky,42.5184,-123.4203
2002,Merlin,OR,Sphere,20 min,Multi colored light in the sky .........,42.5184,-123.4203
2002,Klamath Falls,OR,Formation,1 minute,"Wing shaped UFO Klamath Falls Oregon. Several lights or reflections, Soared like a bird, not straight path, hight altitude no sound. S",42.2249,-121.7817
2002,Clackamas,OR,Other,4 seconds,Had the most intense color white!,45.4076,-122.5704
2002,Salem,OR,Triangle,5 minutes,Three witness low hovering craft over farm field...joint NUFORC and OUFOR investigation.,44.9429,-123.0351
2002,Gresham,OR,Light,10 Minutes,Bright RED light spotted in Southern sky traveling East,45.5001,-122.4302
2002,Springfield,OR,Unknown,3min,"clear night, but not body, rotating lights, not fixed and not a plane or any know air craft.",44.0462,-123.0220
2002,McMinnville,OR,Oval,5 seconds,Glowing oval and flying triangle observed in McMinnville Oregon,45.2101,-123.1987
2002,McMinnville,OR,Triangle,Short,Oval object and triangle shaped craft seen traveling together from bedroom window.,45.2101,-123.1987
2002,Portland,OR,Circle,4 minutes,"Crescent of lights, may have been edge of large craft.",45.5231,-122.6765
2002,Gates,OR,Unknown,5 seconds,Can anyone identify this.,44.7562,-122.4167
2002,Sheridan,OR,Circle,10 minutes,"3 round white lighted objects,hovering then moving quickly across sky,then hovered then went quickly up into space.",45.0993,-123.3948
2002,Christmas Valley,OR,,,Oregon UFO Review Case: Daytime cattle mutilation...same animal hit twice.,43.2378,-120.6709
2002,McMinnville,OR,Disk,,Me and my Mom saw a saucer with many lights hover by a house and trees then disappear with no trace.,45.2101,-123.1987
2002,Bend,OR,Light,1 minute,I did'nt see it at first.Then it came out from behind a tree I was a huge ball of light.,44.0583,-121.3153
2002,Dallas,OR,Light,1 minute,"Oregon UFO Review Case: ""Satellite"" changes directions, performing wild maneuvers.",44.9193,-123.3170
2002,Oregon City,OR,Rectangle,10+ minutes,"Bright, non-circular object hovers far above Oregon City OR at dawn, 2002/05/24",45.3573,-122.6068
2002,Banks,OR,Light,10 minutes,Oregon UFO Review Case: Lights during road trip as phoned into OUFOR.,45.6187,-123.1143
2002,Grants Pass,OR,Oval,2 minutes,"Sighting of very fast object near Grants Pass, OR that made strange moves, and was pursued by jets.",42.4390,-123.3284
2002,Lorane,OR,Triangle,10 minutes,Black triangle with searchlight west of Eugene Oregon,43.8376,-123.2390
2002,Tualatin,OR,Oval,4 seconds,Oregon UFO sighting,45.3840,-122.7640
2002,Portland (Lake Oswego and Gresham),OR,Sphere,2 hours,"Oregon UFO Review Cases: The following 4 reports from Portland, Lake Oswego and Gresham appear to be the same object.",45.5231,-122.6765
2002,Portland,OR,Light,75 minutes,Oregon UFO Review Case: Object releases dark orbs in Portland skies...photographed.,45.5231,-122.6765
2002,Lake Oswego,OR,Circle,25 minutes,"object was white sphere, appeared to be at least 6000 to 7000 ft up, object ABSOLUTELY fixed, nailed in place. size: BB held at arms l",45.4207,-122.6706
2002,Portland,OR,Sphere,1.5 hours,I had just stopped in a local tavern after work (no alchohol prior; 1/2 beer before siting). Several individuals were going out and com,45.5231,-122.6765
2002,Salem,OR,Light,30/40 sec.s,I was looking out the front window of my house. Directly above me was the light. It was a bright white light moving directly east of my,44.9429,-123.0351
2002,Portland,OR,Cigar,10min,The objects I saw were beyond our atmosphere. The size of the cigar object had to be huge for me to see it at that distance.,45.5231,-122.6765
2002,Portland,OR,Circle,15 minutes,"Object appeared in the low horizon and it looked to me to be venus, but then was moving east and rising slightly untill it was about 4",45.5231,-122.6765
2002,St. Helens,OR,Disk,15 minutes,"Fast moving object that moved left to right, stopped, then right to center, then center to left at 1 minute intervals",45.8590,-122.8158
2002,Dorena,OR,Triangle,4 min.,7 people see lights in triangle formation move across sky.,43.7198,-122.8620
2002,Hillsboro,OR,Fireball,1/2 second,A bright flash of white light shot across the sky in an instant with no sound,45.5229,-122.9898
2002,Forest Grove,OR,Unknown,unknown,Oregon UFO Review Case: Crop Formation appears in Forest Grove wheat field.,45.5198,-123.1107
2002,Bend,OR,Triangle,1 1/2 hour,Oregon UFO Review Case: Triangle craft decends to ground level.,44.0583,-121.3153
2002,Bend,OR,Triangle,2 hours,Triangle object and accompanying lights descend rapidly from sky,44.0583,-121.3153
