2013,St. Helens,OR,Sphere,60 seconds,Orange sphere traveling south over st helens Oregon.,45.8590,-122.8158
2013,Hillsboro,OR,Light,20 minutes,Bright light above coastal range observed for 20 mins,45.5229,-122.9898
2013,Salem,OR,Circle,15 minutes,Bright white or reflecting silver ball hovering...others flying by?,44.9429,-123.0351
2013,Waldport,OR,Light,5 minutes,"Five reddish-orange lights over Waldport , Oregon in the SW sky.",44.4268,-124.0687
2013,Lincoln City,OR,Light,5 minutes,Slow moving bright light in the sky.,44.9582,-124.0179
2013,Portland,OR,Fireball,45 seconds,Strange light over Portland.,45.5231,-122.6765
2013,La Grande,OR,Other,every night almost,Nightly aircraft seen over my town.,45.3246,-118.0877
2013,Tigard,OR,Light,27 minutes,This is the second report I've submitted this month since my 1st on 07/03/13 with similar lights.,45.4312,-122.7715
2013,The Dalles,OR,Fireball,3-4 seconds,Yellow and greenish fireball streaking to the west over north central Oregon.,45.5946,-121.1787
2013,Eugene,OR,Unknown,few seconds,Star like white light/ moves across sky and disapears,44.0521,-123.0868
2013,Portland,OR,Circle,35 minutes,I walked outside to my patio and looked to the east I saw a falling star and then a very bright blinking light surrounded by a haze. Co,45.5231,-122.6765
2013,Portland,OR,Formation,15 seconds,"Before seeing this formation we saw two flashes of light at our zenith, and they were not iridium flares.",45.5231,-122.6765
2013,Monroe,OR,Light,6 seconds,Bright light hovered and then vanished behind the treeline.,44.3140,-123.2968
2013,Gresham,OR,Circle,15,6 amber circles forming a diamond shape moving fast in the sky.,45.5001,-122.4302
2013,Lincoln City,OR,Other,2+ hours,"Bright stationary pulsing light accompanied with other objects emanating faint pulses of colored lights (clear,red and blue in color).",44.9582,-124.0179
2013,Knappa,OR,Circle,10+ minutes,Multiple lights in sky.,46.1853,-123.5847
2013,Portland,OR,Formation,5 seconds,V shape formation of 5 soft white lights,45.5231,-122.6765
2013,Philomath,OR,Light,6 minutes,"08/05/13 21:59 Low flying, very large white light, heading north, viewed for 6 minutes.",44.5401,-123.3676
2013,Portland,OR,Oval,40 seconds,Silent white-lighted oval orb followed at distace by smaller reddish object.,45.5231,-122.6765
2013,Milwaukie,OR,Light,2-3 minutes,Small reddish light following the space station very closely behind.((NUFORC Note: Japanese HTV-4 craft flying close to the ISS. PD)),45.4462,-122.6393
2013,Astoria,OR,Light,2 minutes,Orb following space station. ((NUFORC Note: Japanese HTV-4 craft flying close to the ISS. PD)),46.1879,-123.8313
2013,Lincoln City,OR,Circle,4 minutes,"Light orb over Lincoln City, Or.",44.9582,-124.0179
2013,Cannon Beach,OR,Circle,7 minutes,Dim white light went to a super white pulsed 3 blue luminated rings . after 30 seconds the lights retracted back tothe white light then,45.8918,-123.9615
2013,Beaverton,OR,Light,1 minute,Bright white light traveling from west to east that suddenly disappeared.,45.4871,-122.8037
2013,Portland,OR,Fireball,25 seconds,Orange fireball hovers over southeast Portland than disappears,45.5231,-122.6765
2013,Pacific City,OR,Circle,<1 minute,Orange hovering light moving slowly then rapidly then gone into thin air,45.2023,-123.9629
2013,Eagle Creek,OR,Other,10 minutes,"Bright star like object in the west that stopped, moved slowly then stopping again, then it was gone.",45.3575,-122.3589
2013,Hillsboro,OR,Fireball,10 minutes,Strange orange light(flame) in the sky,45.5229,-122.9898
2013,Wilsonville,OR,Cigar,20 seconds,"1 UFO observed 2 times 10 seconds apart, going S to N, then N to S, at 22:15 hrs over Wilsonville, OR on 9/1/13.",45.2998,-122.7737
2013,Lincoln City,OR,Light,2 minutes,Seen a red solid light moving from west to east. The object was not flashing like a airplane and was a difrent collor. It disappeared i,44.9582,-124.0179
2013,Lincoln City,OR,Circle,60 seconds,A round orange ball of light- looking like fire traveled north across the sky before fading in the distance. It seemed to be rotating a,44.9582,-124.0179
2013,Lincoln City,OR,Light,Few minutes,Bright red to dark slow flashing.,44.9582,-124.0179
2013,Merrill,OR,Flash,4 hours,White flashes of light over mountains in Southern Oregon.,42.5184,-123.4203
2013,Springfield,OR,Sphere,30 seconds,"Springfield, OR bright orange sphere hovering in sky over pasture.",44.0462,-123.0220
2013,Hillsboro,OR,Triangle,15 seconds,Dull black triangle with 4 lights moved quickly overhead from horizon to horizon,45.5229,-122.9898
2013,McMinnville,OR,Triangle,10 minutes,"Very slow moving object rectangular in shape with orange and red lights, making no sound.",45.2101,-123.1987
2013,Canby,OR,,4 minutes,3 bright white flashes of light that lit up the entire sky.,45.2623,-122.6921
2013,Canby,OR,Sphere,5 minutes,Three amber orbs or spheres.,45.2623,-122.6921
2013,Klamath Falls,OR,Teardrop,10 minutes,Fast moving aircraft with little jet trail moves across Oregon sky's.,42.2249,-121.7817
2013,Portland,OR,Other,30 minutes,Saw Oct 3 2013 total of 15 craft with 5 lower than the others going in counterclock with 4 vertical rows of lights semi circ nose.,45.5231,-122.6765
2013,Albany,OR,Fireball,10 minutes,Woman and adult daughter witness cluster of orange lights near the Albany Hospital.,44.6350,-123.1059
2013,Salem,OR,Triangle,15 minutes,Brilliant star-like object hovers above trees and shines bright lights before changing into golden triangle.,44.9429,-123.0351
2013,Salem,OR,Triangle,15 minutes,"Low flying star-like object transforms into shining golden triangle in Salem, OR.",44.9429,-123.0351
2013,Gresham,OR,Fireball,20 minutes,My wife and I witnessed 16 - 20 orange orb-shaped objects that passed over us either solo or sets of two!,45.5001,-122.4302
2013,Seaside,OR,Light,15 minutes,White lights over Pacific Ocean.,45.9932,-123.9226
2013,Eugene,OR,Fireball,5 minutes,10 orange orbs moving slow from east to west. Last one hovered before it vanished. No sound.,44.0521,-123.0868
2013,Rockaway Beach,OR,Light,3-4 minutes,Unexplainable light moving in a ways not achievable by known aircraft.,45.6134,-123.9429
2013,Canyonville,OR,Unknown,1 hour,"3 lighted spacecrafts that formed Triangular shape & ascended straight up into the sky, moving at unbelievable speed.",42.9273,-123.2812
2013,Seaside,OR,Light,15 minutes,Bright white light in the dusk sky over ocean.,45.9932,-123.9226
2013,Keizer,OR,Fireball,30 seconds,"Went out to smoke, heard segulls, looked up, saw random orange ball move quickly like a shooting star and make a big angled curve.",44.9901,-123.0262
2013,Brownsville,OR,Disk,4-6 minutes,19-Oct-13 Brownsville Oregon on Kirk Ave. in a large clearcut.,44.3935,-122.9848
2013,Summer Lake,OR,Light,20 minutes,10-23 and 24th of oct 13 summer lake OR. 9:00 p.m. orange balls of light 7 at one time in diagnal and in twos,42.9729,-120.7778
2013,Brothers,OR,Light,45 minutes,I saw two groups of lights that appeared to be separate craft.,43.8136,-120.6027
2013,Eugene,OR,Other,5 minutes,"Bright orange light, flying low, moving slowly & was silent",44.0521,-123.0868
2013,Beaverton,OR,,,"2 orange orbs flickerig ,flying in sky over beaverton oregon.",45.4871,-122.8037
2013,Milton-Freewater,OR,Light,Unknown,"Witnessed floating yellow light high in the sky. It did not move, and appeared to be distant.",45.9326,-118.3877
2013,Coos Bay,OR,Light,Ongoing (Possibly),Star like object moving sporadically in northwest sky night after night. ((NUFORC Note: Venus? PD)),43.3665,-124.2179
2013,Medford,OR,Triangle,2 minutes,"Hovering triangle shape, bright white light on each corner, silent, took off very fast.",42.3265,-122.8756
2013,Grants Pass,OR,Fireball,20 seconds,Red orange fire ball northbound at a curve towards earth.,42.4390,-123.3284
2013,Keizer,OR,Cylinder,4 minutes,"Hovering Orange-ish light over Keizer, OR.",44.9901,-123.0262
2013,Albany,OR,Circle,5,Five orange globes in the sky. Soft looking. Moving slowly across the sky.,44.6350,-123.1059
2013,John Day,OR,Circle,2 minutes,"Disk over John Day, Oregon. And giant red flames 3 in all taking off by Lakeview, Oregon.",44.4160,-118.9530
2013,Lincoln City,OR,Teardrop,25-30 seconds,12-inch long teardrop shaped hovering craft along Oregon Coast.,44.9582,-124.0179
2013,Springfield (?),OR,Circle,30 minutes,Was moving in different directions at really fast speeds.,44.0462,-123.0220
2013,West Linn,OR,Other,3 minutes,3 vertical rectangular lights seen hovering.,45.3657,-122.6123
2013,Jefferson,OR,Sphere,5 seconds,Object was shaped like a long bright Bar very bright in the north sky above my back yard field.... at 8:15pm traveled 5 sec and the,44.7196,-123.0104
2013,Redmond,OR,Sphere,10 minutes,"Glowing orange spheres over Redmond, Oregon.",44.2726,-121.1739
2013,Albany,OR,Circle,>1 hour,"5 bright flashing lights, blue, red, green and white.",44.6350,-123.1059
2013,Bend,OR,Light,7-10 minutes,Eight bright red lights in the sky.,44.0583,-121.3153
2013,Bend,OR,Light,15 minutes,Nine circular bright orange and yellow objects moving slowly then rising higher then vanished.,44.0583,-121.3153
2013,Bend,OR,Circle,5 minutes,We saw 6 very bright orange lights low in the sky. Much larger and brighter then stars.,44.0583,-121.3153
2013,Springfield,OR,Formation,5 minutes,"Solid line of bright red lights, then transitioning to blue but in longer duration than a plane. Craft circled back very quickly.",44.0462,-123.0220
2013,Springfield,OR,Cross,30 seconds,"T-shaped UFO with red and blue lights sighted in Springfield, OR.",44.0462,-123.0220
2013,Lake Oswego,OR,Diamond,3-4 minutes,"Diamond shaped, black, large, flat craft with 3 or 4 white lights and 1 red blinking light hovering in Lake Oswego, OR.",45.4207,-122.6706
2013,Brookings,OR,Cigar,west coast,Cigar shaped craft over southern Oregon coast.,42.0526,-124.2840
2013,Salem,OR,Rectangle,15 minutes,Rectangular space craft following me and basically stalking me it had looked like extraterrestrial creatures were inside.,44.9429,-123.0351
2013,Milwaukie,OR,Fireball,90 seconds,Fireball like object flying in a inconsistent line completely disappears from sight.,45.4462,-122.6393
2013,Portland,OR,Light,10 seconds,Three bright white lights in a triangular formation.,45.5231,-122.6765
2013,Talent,OR,Unknown,1 minute,"I live in Southern Oregon along Interstate 5. I was out throwing a ball for my dog tonight, it was super dark and very cold, so per",42.2457,-122.7886
2013,Medford,OR,Circle,30 minutes,"Multi-color lights flashing a pattern. ((NUFORC Note: Probable sighting of star, Sirius. PD))",42.3265,-122.8756
2013,Portland (southeast of),OR,Light,1 minute,Strange constant set of lights moving East to West over inner SE portland skyline,45.5231,-122.6765
2013,Hillsboro,OR,Unknown,2 minute,3 large orange/red lights in Eastern sky NO sound then vanished one by one.,45.5229,-122.9898
2013,Gresham,OR,Other,1 minute,Bright purple light over a busy intersection.,45.5001,-122.4302
2013,Roseburg,OR,Light,45 seconds,Light gliding across the sky,43.2165,-123.3417
2013,Roseburg,OR,Formation,~30 seconds,4 crafts seen gliding slowly in the air,43.2165,-123.3417
2013,Springfield,OR,Light,5 minutes,Orange Orb flies over Springfield.,44.0462,-123.0220
2013,Sumpter,OR,Light,4 minutes,Orange glowing lights rising.,44.7457,-118.2022
2013,Salem,OR,Triangle,10 seconds,We saw 3 lights in the sky!!!,44.9429,-123.0351
2013,Portland,OR,Flash,1 second +/- 0.5 Sec,"Streaking Bright Flash Witnessed over Portland, Oregon.",45.5231,-122.6765
2013,Portland,OR,Oval,4 minutes,Large orange light.,45.5231,-122.6765
2013,Springfield,OR,Light,15 minutes,Circular vague light traveling at high speeds in jerky circles... very strange.,44.0462,-123.0220
2013,Athena,OR,Cross,30 minutes,THERE'S SHIPS UP THERE.,45.8118,-118.4905
2013,Brookings,OR,Other,10 minutes,Orange balls.,42.0526,-124.2840
2013,La Grande,OR,Light,,3 seen.,45.3246,-118.0877
2013,Albany,OR,Circle,15 minutes,New Years Eve 2013 sighting of four orange lights in Albany Oregon.,44.6350,-123.1059
2013,Portland,OR,Fireball,2-3 minutes,Just about ready to pull into my driveway when I spotted three orange fireball like objects west of our location. I told my wife what,45.5231,-122.6765
2013,Eugene,OR,Light,1 minute,Orange light moving slowly then hovered then faded to pin sized dot and headed West.,44.0521,-123.0868
2013,Tigard (near),OR,Fireball,~1 hour,"Large orange fireball witnessed on New Year's Eve near Tigard, OR",45.4312,-122.7715
2013,Portland,OR,Fireball,5-10 seconds,Bright white object turned reddish-orange and switched direction at 45 degree angle at high altitude and speed.,45.5231,-122.6765
2013,Corvallis,OR,Circle,1 minute,2 amber lights dimming as ascending into sky. Moving then stopping.,44.5646,-123.2620
2014,Springfield,OR,Circle,5 minutes,As we were watching the fireworks five or six orb like shapes hovered slowly across the sky and then seem to have disappeared moving aw,44.0462,-123.0220
2014,Salem,OR,Light,5 minutes,Six yellow-orange lights with reddish halos moving from NE to SW at midnight on New Year's Eve spaced about 45 seconds apart; no sounds,44.9429,-123.0351
2014,Salem,OR,Circle,7 minutes,Looked like some sort of patrol or scouting team.,44.9429,-123.0351
2014,Powers,OR,Unknown,still going,"Wednesday Jan 1 8:45 PM South west, Oregon Near Powers Right now it is 8:53 to the east of Powers Hovering over what appears to Eden Ri",42.8834,-124.0732
2014,Prineville,OR,Oval,seconds?,Took photos with new camera (FujiFilm HS50EXR)at close to full zoom (approx 800mm). ((NUFORC Note: Mourning dove in flight? PD)),44.2998,-120.8345
2014,Oregon City,OR,Unknown,10-15 minutes,"Saw what appeared to be a star, but had some red and blue colors too, and moves zig zag, & up, and down.",45.3573,-122.6068
2014,Portland,OR,Light,90 seconds,"Slow moving red orb, multidirectional.",45.5231,-122.6765
2014,Oregon City,OR,Circle,5 seconds,"White round light or object with a haze hovered for a short moment then moved quickly across sky at an arched angle, then disappeared.",45.3573,-122.6068
2014,Roseburg,OR,Oval,2 hours,Slow moving orbs seen slow.,43.2165,-123.3417
2014,Portland,OR,,1 minute,I was sitting in my family room watching the tv. We have high ceilings in the family room with windows and can see the sky. All of a,45.5231,-122.6765
2014,Portland,OR,Light,3 seconds,"An odd white light streaked briefly overhead and then disappeared. Looked like it was on a diagonal path. Lasted only 3 seconds, but wa",45.5231,-122.6765
2014,Clackamas,OR,Light,5 minutes,"Small lights in the sky over Clackamas, Oregon.",45.4076,-122.5704
2014,Hillsboro,OR,Formation,2 minutes,Red stationary lights in sky.,45.5229,-122.9898
2014,Portland,OR,Unknown,1 hour,Red flashing dots witnessed by 5 people 2 in Hillsboro. lasted over a hour and is still going on as if 2:03 AM..,45.5231,-122.6765
2014,Salem,OR,Flash,1.5 hours,"Brilliant colorful flashing lights moving in a very unconventional way @ 1:30am on January 25, 2014 in Salem Oregon.",44.9429,-123.0351
2014,Diamond Lake,OR,Light,3 minutes,"Big red orb flying over Diamond Lake, Or.",43.1737,-122.1521
2014,Eugene,OR,Changing,15 minutes,"Southern sky, heavy clouds. First one appeared to be a hangglider, but too high never descended. A silver-gray Stealth fighter jet sha",44.0521,-123.0868
2014,Salem,OR,Unknown,35 seconds,Formation of glowing red objects,44.9429,-123.0351
2014,Salem,OR,Sphere,1 minutes,Approx. 7 orange orb that looked in formation of the Big Dipper then disappeared and faded away.,44.9429,-123.0351
2014,Gresham,OR,Fireball,2.5 minutes,"10 silent red ""fireballs,"" zoomed together, configured themselves and disappeared",45.5001,-122.4302
2014,Myrtle Creek,OR,Light,10 minutes,several lights shaped in an s pattern moving slowly with a flashing light redish in color.Dont know if what I saw was a ufo or somrthin,43.0201,-123.2931
2014,Portland,OR,Light,3 seconds,White light moved across the sky at an unbelievable speed.,45.5231,-122.6765
2014,Portland,OR,Other,15 minutes,Red/Orange Blinking orb over the North/Northwestern sky in Portland Oregon,45.5231,-122.6765
2014,Portland,OR,Unknown,15 minutes,Bright red orb over N. Portland.,45.5231,-122.6765
2014,Independence,OR,Light,2 minutes,Independence Or Orange Light Ball UFO,44.8512,-123.1868
2014,Portland,OR,Light,20 minutes,Bright star light opject moving slowly in a giggling motion across the sky Miller/Barnes rd Portland Oregon.,45.5231,-122.6765
2014,Scappoose,OR,Light,20 seconds,"Red light seen in sky over Scappoose, Oregon, Feb 8th, 2014, during snow storm.",45.7543,-122.8776
2014,Salem,OR,Circle,2-5 seconds,"Bright light, then disappeared.",44.9429,-123.0351
2014,Portland,OR,Circle,4 minutes,Three orange glowing lights in the eastern sky.,45.5231,-122.6765
2014,Seaside,OR,Disk,Seconds,Bright spinning disk like with windows on top part.,45.9932,-123.9226
2014,Sandy,OR,Oval,2 minutes,2 red orbs traveling slowly towards the city of Sandy.,45.3973,-122.2615
2014,Milwaukie,OR,Triangle,1 minute,Triangle-shaped with lights.,45.4462,-122.6393
2014,Bend,OR,Triangle,15 minutes,Triangular shaped object with moving lights moving in side to side motion before disappearing.,44.0583,-121.3153
2014,Beaverton,OR,Light,4 minutes,4 vertical aligned red lights in south/southwest sky.,45.4871,-122.8037
2014,Salem,OR,Light,2 minutes,"Dual, nondescript white lights hovering motionless over the interstate.",44.9429,-123.0351
2014,Oregon City,OR,Fireball,2 minutes,"Fireball--slow moving, large.",45.3573,-122.6068
2014,St. Helens,OR,Circle,1 minute,Multiple glowing orbs seen heading NE over St. Helens,45.8590,-122.8158
2014,Sutherlin,OR,Light,5-10 minutes,Orange light in night sky dropping smaller light.,43.3901,-123.3126
2014,Gresham,OR,Light,10 minutes,Blinking blue and red star disappears.,45.5001,-122.4302
2014,Beaverton,OR,Circle,10 minutes,Blue light orb that changes colors to red and white.,45.4871,-122.8037
2014,Gresham,OR,Triangle,Seconds,UFO's recorded from my RC airplane. Debunk this!,45.5001,-122.4302
2014,Medford,OR,Disk,"1 hour, 11 minutes",Large multicolored disk radiating many colors w/ long hanging arms hovering over an hour above Griffin/Sterling Creek area.,42.3265,-122.8756
2014,Medford,OR,Light,3 seconds,Red light traveling at extreme speed.,42.3265,-122.8756
2014,Portland,OR,Unknown,30 seconds,Very fast moving object with red and blue lights.,45.5231,-122.6765
2014,Eugene (general area),OR,Egg,2 minutes,((HOAX??)) Red and blue egg like shaped.flying ahead of me then drifted like a zigzag then took off really fast the opposite way.,44.0521,-123.0868
2014,Brookings,OR,Light,8-10 seconds,"Fast moving light orb above clouds, Brookings, Oregon at sunset.",42.0526,-124.2840
2014,Union,OR,Flash,30 seconds,Light here light gone.,45.2085,-117.8652
2014,Aloha,OR,Oval,8 minutes,"Witnessed 3 glowing orange orbs fly in a straight line directly overhead in a steady direction, one after another with about 30 seconds",45.4943,-122.8670
2014,Medford,OR,Cone,1 hour,((HOAX??)) UFO's in Medford Oregon on April 9th 2014.,42.3265,-122.8756
2014,Newport,OR,Oval,~1 hour,Orange oval floating light on ocean unaffected by waves speeds up and slows down on the water.,44.6368,-124.0535
2014,Boring,OR,Cylinder,1 hour,"Spinning, tubular UFO flies and flashes acrross sky while several others in sight in Boring.",45.4314,-122.3735
2014,Hillsboro,OR,Unknown,few seconds,"Flashing Strobes in the sky, not a helicopter.",45.5229,-122.9898
2014,Portland,OR,Sphere,1 minute,Sphere - Multiple Colors - Sporadic Movement - During Lunar Eclipse.,45.5231,-122.6765
2014,Portland,OR,Light,5 minutes,White orb that was bright fading in and out slowly moving across the sky.,45.5231,-122.6765
2014,Carlton,OR,Light,1 minute,Bright yellowish gold precise upward arking upward movement silent,45.2943,-123.1765
2014,Bend,OR,Light,45 minutes,Bright light traveling in circles around Venus.,44.0583,-121.3153
2014,Cannon Beach,OR,Light,5 minutes,2 orange orbs and 3 white disks objects was seen by 2 witnesses.,45.8918,-123.9615
2014,Portland (northeast area),OR,Flash,5 minutes,((HOAX??)) Bright orb growing in size and then shrinking.,45.5231,-122.6765
2014,The Dalles,OR,Formation,10 minutes,"Formation of 5 ufos sighted over The Dalles, Oregon.",45.5946,-121.1787
2014,Springfield,OR,Fireball,5 minutes,"Huge red ball of fire from the west traveled quickly to the south, then hovered for a minute or two, and disappeared.",44.0462,-123.0220
2014,Salem,OR,Other,2 minutes,Large Orange Oblong Light Travelling Slowing Across The Sky.,44.9429,-123.0351
2014,McNary,OR,Cross,1.5-2.0 minutes,Cross shape object with orange lights above our home.,45.9193,-119.2892
2014,Umatilla,OR,Circle,5 minutes,Ball with 4 orange lights in the sky.,45.9174,-119.3425
2014,Newport,OR,Light,3-5 minutes,Object in night sky lands/communicates with Vega.,44.6368,-124.0535
2014,Portland,OR,Sphere,few minutes,I saw a series of events that seem to defy common knowledge.,45.5231,-122.6765
2014,Bend,OR,Disk,20 seconds,"Reflective, oval, disk-shaped object with a haze around it, appearing and disappearing, travelling at an astonishing rate of speed.",44.0583,-121.3153
2014,Portland,OR,Light,15 minutes,"Round object glowing yellow, red, orange hue.",45.5231,-122.6765
2014,Portland,OR,Unknown,0:05,Vibrant colorful lights throbbing across the sky in the middle of the night.,45.5231,-122.6765
2014,Lewisburg,OR,Oval,1 second,Black oval object in the sky.,44.6239,-123.2425
2014,Tigard,OR,Triangle,2 hours,Three Orange triangle lights hoover over us and little lights come shooting out super fast,45.4312,-122.7715
2014,Cottage Grove,OR,Unknown,few seconds,"Very bright red and blue lights,single object and unusual flight characteristics.",43.7976,-123.0595
2014,Wapinitia,OR,Light,2 minutes,50 degree long streak of white light seen in sky for two minutes.,45.1144,-121.2553
2014,Portland,OR,Sphere,20 minutes,"Neon Green Stealth like sphere with pulsating lights, witnessed by 2 adults and a child.",45.5231,-122.6765
2014,La Grande,OR,Light,1-2 minutes,Fast moving orange light in night sky.,45.3246,-118.0877
2014,Bend,OR,Light,8 minutes,Four orange lights moving southeast and dissapeared into the sky.,44.0583,-121.3153
2014,Grants Pass,OR,Fireball,2 minutes,"Reddish orange fiery ball moving away from the earth, could not send any text messages for up to an hour afterward.",42.4390,-123.3284
2014,Portland,OR,Teardrop,5 seconds,"Large floating UFO near Portland, Oregon airport as seen from plane.",45.5231,-122.6765
2014,Salem,OR,Changing,~2 minutes,"Peculiar cluster of colored lights in the sky, changing pattern, one pattern was an oval, the brightest one was red and in the middle",44.9429,-123.0351
2014,Portland,OR,Light,3 minutes,"Yellow, orange, and red flashing light staying stationary in sky then traveling east.",45.5231,-122.6765
2014,Salem,OR,Triangle,15 minutes,True story of alien army seen!!!!!,44.9429,-123.0351
2014,Portland,OR,Changing,10,"Very bright red, blue, and green object accompanied by loud hum, moved quickly and then came back, six white circle lights too.",45.5231,-122.6765
2014,La Grande,OR,Other,5,"Black tip, yellow middle, flying together. From a distance, looked like a bunch of balloons. Looked thru bino's. to confirm. Six obj",45.3246,-118.0877
2014,Portland,OR,Fireball,2 minutes,5 red balls in formation heading west to east.,45.5231,-122.6765
2014,Newport,OR,Light,20 minutes,Numerous orange lights drifting inland from over the ocean.,44.6368,-124.0535
2014,Wilsonville,OR,Sphere,5 minutes,"Spherical white [pearl-like] object WITHIN OUR ATMOSPHERE, motionless, appeared to be nailed to the sky.",45.2998,-122.7737
2014,Otis,OR,Cigar,20 minutes,"Craft was sivler or metallic, reflected light, very bright and just stayed there",45.0243,-123.9465
2014,McMinnville,OR,Formation,3-5 minutes,"Several light orbs sighted over McMinnville, Oregon, June 20, 2014.",45.2101,-123.1987
2014,Portland,OR,Formation,1 minute,Six oval-like objections seen flying in formation.,45.5231,-122.6765
2014,Portland,OR,Other,15 minutes,"14 lights of various size, shape and color over Portland, Oregon",45.5231,-122.6765
2014,Kerby,OR,Circle,3 minutes,"We were outside giving my child a ride on my dads tractor. Afterwards, we stood and were talking, when i became fixed on a ball of ligh",42.1943,-123.6517
2014,Portland,OR,Light,30-45 seconds,Intense white lights followed by red and blue lights,45.5231,-122.6765
2014,Myrtle Creek,OR,Circle,5 minutes,Fireball in sky.,43.0201,-123.2931
2014,Myrtle Creek,OR,Fireball,20 minutes,Orange fireball observed in sky over Southern Oregon.,43.0201,-123.2931
2014,Beaverton,OR,Oval,10 minutes,White Oval Lights Circling in the Sky.,45.4871,-122.8037
2014,Coos Bay,OR,Circle,3 minutes,I watched a UFO appear flashing as it crossed the sky.,43.3665,-124.2179
2014,Lake Oswego,OR,Circle,40 seconds,A round bright white-yellow disk of light hovering up in the sky with a beam of light coming out of it.,45.4207,-122.6706
2014,Mt. Hood,OR,Triangle,1:00,We saw an aircraft doing unsual flight charictaristics.,45.3736,-121.6960
2014,Salem,OR,Sphere,~24 minutes,Metallic sphere moving and changing directions.,44.9429,-123.0351
2014,Coos Bay,OR,Light,5-10 seconds,Bright orange point of light travelling very fast across sky .,43.3665,-124.2179
2014,Creswell,OR,Light,2 minutes,"Bright red-orange light seen moving slowly, silently, first south, then east, no gain/loss in altitude. 4 witnesses. 2-3min observation",43.9179,-123.0245
2014,Eugene,OR,,2.5 minutes,ORANGE CYLINDER OVER EUGENE ON THE 4th.,44.0521,-123.0868
2014,Hillsboro,OR,Light,30 minutes,7 red lights.,45.5229,-122.9898
2014,Redmond,OR,Fireball,2 minutes,Red light in oregon sky's.,44.2726,-121.1739
